{
  "providerId": "ffmpeg",
  "kind": "software-tool",
  "access": {
    "type": "none",
    "notes": "Local binary; no credentials (P8)."
  },
  "executionAdapter": {
    "id": "ffmpeg-cli",
    "transport": "cli",
    "runtimeRequirements": "Phase 2 TL glue: local software tool registered into the provider plane (tier local)."
  },
  "capabilities": [
    {
      "capabilityId": "editor.cut-video",
      "maturity": "stable",
      "conformanceStatus": "self-verified",
      "notes": "cli mode live-verified in sandbox; reencode + stream-copy"
    },
    {
      "capabilityId": "editor.composite-layer",
      "maturity": "stable",
      "conformanceStatus": "self-verified",
      "notes": "avfilter graph composite"
    },
    {
      "capabilityId": "editor.render-project",
      "maturity": "stable",
      "conformanceStatus": "self-verified",
      "notes": "EDL \u2192 argv render pipeline"
    }
  ],
  "facts": {
    "rateLimits": "none (local process spawn; sandbox concurrency governs)",
    "pricing": "compute-minutes only; no per-call cost",
    "latencyFacts": "subsecond startup (measured 57ms cold); render scales with duration/resolution",
    "healthCheck": "binary version probe before spawn (adapter-side)"
  },
  "notes": "Phase 2 TL glue: local software tool registered into the provider plane (tier local)."
}