{
  "providerId": "mlt",
  "kind": "software-tool",
  "access": {
    "type": "none",
    "notes": "Local binary; no credentials (P8)."
  },
  "executionAdapter": {
    "id": "mlt-cli",
    "transport": "cli",
    "runtimeRequirements": "Phase 2 TL glue: local software tool registered into the provider plane (tier local)."
  },
  "capabilities": [
    {
      "capabilityId": "editor.cut-video",
      "maturity": "stable",
      "conformanceStatus": "self-verified",
      "notes": "EDL-driven cut"
    },
    {
      "capabilityId": "editor.composite-layer",
      "maturity": "stable",
      "conformanceStatus": "self-verified",
      "notes": "track compositing"
    },
    {
      "capabilityId": "editor.render-project",
      "maturity": "stable",
      "conformanceStatus": "self-verified",
      "notes": "melt render"
    }
  ],
  "facts": {
    "rateLimits": "none (local process spawn; sandbox concurrency governs)",
    "pricing": "compute-minutes only; no per-call cost",
    "latencyFacts": "seconds startup; render minutes-scale",
    "healthCheck": "binary version probe before spawn (adapter-side)"
  },
  "notes": "Phase 2 TL glue: local software tool registered into the provider plane (tier local)."
}